{
  "format": "runic.views.scenario/1",
  "id": "state-changes.two-sets-of-one-field-recover.v1",
  "contract": {"id":"runic.views","version":4},
  "set": "state-changes",
  "roles": ["client"],
  "description": "A frame with two set changes of one field breaks the ordering rules: the client keeps its state and recovers.",
  "view": "notes",
  "ids": {
    "c1": {"kind":"connection"},
    "hello-c1": {"kind":"request"},
    "session": {"kind":"wire","value":"s-1"},
    "open-notes": {"kind":"call"},
    "open-notes-request": {"kind":"request"},
    "presentation": {"kind":"wire","value":"p-1"},
    "recovery": {"kind":"request"}
  },
  "arrange": {"model":{}},
  "steps": [
    {"connect":"c1"},
    {
      "send": {
        "kind": "hello",
        "protocol": 4,
        "session": {"$id":"session"},
        "client": {"name":{"$any":"string","default":"conformance-client"},"version":{"$any":"string","default":"1.0.0"}}
      },
      "id": "hello-c1"
    },
    {
      "receive": {
        "ok": true,
        "protocol": 4,
        "implementation": {"name":{"$any":"string","default":"conformance-producer"},"version":{"$any":"string","default":"1.0.0"}}
      },
      "replyTo": "hello-c1"
    },
    {"call":{"id":"open-notes","op":"open","route":"notes"}},
    {"send":{"kind":"open","route":"notes","presentation":{"$id":"presentation"}},"id":"open-notes-request"},
    {
      "receive": {
        "ok": true,
        "revision": 0,
        "state": {
          "title": "",
          "note": "",
          "priority": "Normal",
          "due": null,
          "elapsed": "PT0S",
          "rows": [],
          "count": 0,
          "summary": "rows: 0",
          "detail": {"kind":"detail","id":"0123456789abcdef0123456789abcdef"},
          "canClear": false,
          "canTouch": true,
          "canSave": true,
          "canConfirmClear": false,
          "isSlowImportExecuting": false,
          "isConfirmClearExecuting": false
        },
        "fields": {"note":{"version":0}},
        "presentation": "ok"
      },
      "replyTo": "open-notes-request"
    },
    {
      "receive": {
        "kind": "frame",
        "route": "notes",
        "baseRevision": 0,
        "revision": 1,
        "changes": [{"field":"title","kind":"set","value":"a"},{"field":"title","kind":"set","value":"b"}]
      }
    },
    {"send":{"kind":"snapshot","route":"notes"},"id":"recovery"},
    {
      "receive": {
        "ok": true,
        "revision": 1,
        "state": {
          "title": "b",
          "note": "",
          "priority": "Normal",
          "due": null,
          "elapsed": "PT0S",
          "rows": [],
          "count": 0,
          "summary": "rows: 0",
          "detail": {"kind":"detail","id":"0123456789abcdef0123456789abcdef"},
          "canClear": false,
          "canTouch": true,
          "canSave": true,
          "canConfirmClear": false,
          "isSlowImportExecuting": false,
          "isConfirmClearExecuting": false
        },
        "fields": {"note":{"version":0}}
      },
      "replyTo": "recovery"
    },
    {
      "expect": {
        "state": {
          "route": "notes",
          "value": {
            "title": "b",
            "note": "",
            "priority": "Normal",
            "due": null,
            "elapsed": "PT0S",
            "rows": [],
            "count": 0,
            "summary": "rows: 0",
            "detail": {"kind":"detail","id":"0123456789abcdef0123456789abcdef"},
            "canClear": false,
            "canTouch": true,
            "canSave": true,
            "canConfirmClear": false,
            "isSlowImportExecuting": false,
            "isConfirmClearExecuting": false
          }
        }
      }
    }
  ]
}
