{
  "format": "runic.views.scenario/1",
  "id": "state-changes.move-move-backward.v1",
  "contract": {"id":"runic.views","version":4},
  "set": "state-changes",
  "roles": ["producer","client"],
  "description": "A move takes rows from oldIndex and inserts them at index, the final position after removal. keys are the moved rows' keys; items is empty. Case: move backward.",
  "source": "specs/application/fixtures/collection-deltas/move.json#move backward",
  "view": "list",
  "ids": {
    "c1": {"kind":"connection"},
    "hello-c1": {"kind":"request"},
    "session": {"kind":"wire","value":"s-1"},
    "open-list": {"kind":"call"},
    "open-list-request": {"kind":"request"},
    "presentation": {"kind":"wire","value":"p-1"},
    "final-read": {"kind":"request"}
  },
  "arrange": {"model":{"rows":[{"id":1,"label":"one"},{"id":2,"label":"two"},{"id":3,"label":"three"}],"title":"rows"}},
  "steps": [
    {"connect":"c1"},
    {
      "send": {
        "kind": "hello",
        "protocol": 4,
        "session": {"$id":"session"},
        "client": {"name":{"$any":"string","default":"conformance-client"},"version":{"$any":"string","default":"1.0.0"}}
      },
      "id": "hello-c1"
    },
    {
      "receive": {
        "ok": true,
        "protocol": 4,
        "implementation": {"name":{"$any":"string","default":"conformance-producer"},"version":{"$any":"string","default":"1.0.0"}}
      },
      "replyTo": "hello-c1"
    },
    {"call":{"id":"open-list","op":"open","route":"list"}},
    {"send":{"kind":"open","route":"list","presentation":{"$id":"presentation"}},"id":"open-list-request"},
    {
      "receive": {
        "ok": true,
        "revision": 0,
        "state": {"rows":[{"id":1,"label":"one"},{"id":2,"label":"two"},{"id":3,"label":"three"}],"title":"rows"},
        "presentation": "ok"
      },
      "replyTo": "open-list-request"
    },
    {"mutate":[{"op":"move","oldIndex":2,"newIndex":0}]},
    {
      "receive": {
        "kind": "frame",
        "route": "list",
        "baseRevision": 0,
        "revision": 1,
        "changes": [{"field":"rows","kind":"move","index":0,"oldIndex":2,"keys":["3"],"items":[]}]
      }
    },
    {"send":{"kind":"snapshot","route":"list"},"id":"final-read","role":"producer"},
    {
      "receive": {
        "ok": true,
        "revision": 1,
        "state": {"rows":[{"id":3,"label":"three"},{"id":1,"label":"one"},{"id":2,"label":"two"}],"title":"rows"}
      },
      "replyTo": "final-read",
      "role": "producer"
    },
    {
      "expect": {
        "state": {
          "route": "list",
          "value": {"rows":[{"id":3,"label":"three"},{"id":1,"label":"one"},{"id":2,"label":"two"}],"title":"rows"}
        }
      }
    }
  ]
}
